Folder,Name,MyPrice,AmazonPrice,Details
catFeeder,Dual-Lens Automatic Cat Feeder with Camera for 2 Cats,40,99.99,"Dual-Lens Automatic Cat Feeder with Camera for 2 Cats, 6L1080P HD Video Pet Food Dispenser with Dual Bowls, AI Motion Detection & 2-Way Audio, App Control Timed Feeder for Multi-Cat Household"
BigDildo,BigDildo,40,99.99,"This all-in-one sex toys machine set includes: 1x Realistic Dildo, 1x Vibrating Dildo, 1x Anal Butt Plug, 1x Bracket, 1x Universal suction cup, 1x Stable Suction Cup Base, and 1x remote control. Our Adult Toys machine with 9 thrust modes, 9 vibration modes, and heating function can provide you with a hands-free and deep impact experience,so this fucking machine very suitable for man or women (Note: Only the Large vibrating dildo supports heating and vibration functions)."
Soup,Soup,29.99,59.99,"Fresh Homemade Soup in 20 Minutes – Enjoy hot, comforting soup made from scratch with minimal effort—perfect for quick lunches, cold evenings, or healthy eating at home.
2-in-1 Hot & Cold Functionality – Blend chilled smoothies or heat fresh soups in one compact appliance. Ideal for everything from fruit juices to chunky veg soups.
Smart Automatic Blending – With built-in stir, blend, and heat settings, your meals are made hands-free. Just add ingredients and let it do the work.
Clean & Safe to Use – Overspill spout and auto shut-off help avoid mess, while cool-touch housing keeps hands safe. Great for families and busy cooks."
