Folder,Name,MyPrice,AmazonPrice,Details
catFeeder,Dual-Lens Automatic Cat Feeder with Camera for 2 Cats,40,99.99,"Dual-Lens Automatic Cat Feeder with Camera for 2 Cats, 6L1080P HD Video Pet Food Dispenser with Dual Bowls, AI Motion Detection & 2-Way Audio, App Control Timed Feeder for Multi-Cat Household"
kindle-paperwhite,Kindle Paperwhite (11th Gen),89.99,149.99,"Kindle Paperwhite with 6.8 inch display and adjustable warm light. 8GB storage, waterproof. Includes original USB-C cable and box."
echo-dot,Echo Dot (5th Gen) with Clock,24.99,59.99,"Amazon Echo Dot smart speaker with LED clock display. Charcoal color. Works perfectly, factory reset and ready to go."
echodot2,echodot2,12,1223,"Amazon Echo Dot smart speaker with LED clock display. Charcoal color. Works perfectly, factory reset and ready to go."
BigDildo,BigDildo,40,99.99,"This all-in-one sex toys machine set includes: 1x Realistic Dildo, 1x Vibrating Dildo, 1x Anal Butt Plug, 1x Bracket, 1x Universal suction cup, 1x Stable Suction Cup Base, and 1x remote control. Our Adult Toys machine with 9 thrust modes, 9 vibration modes, and heating function can provide you with a hands-free and deep impact experience,so this fucking machine very suitable for man or women (Note: Only the Large vibrating dildo supports heating and vibration functions)."
